{
  "schema_version": "storyworld_instance_sweep_v1",
  "sweep_id": "mizan_competing_claims_sweep_v1",
  "base_world_paths": [
    "experiments/storyworld_curriculum_v1/worlds/train/mizan_competing_claims_train_v1.json",
    "experiments/storyworld_curriculum_v1/worlds/train/multicriteria_appeals_train_v1.overlay.json"
  ],
  "required_factors": ["resources", "observation", "authority", "timing", "counterpart_behavior"],
  "profiles": [
    {"profile_id": "baseline", "description": "Standard fund, separated advocate evidence, ordinary authority, ordinary deadline, and an uncertain infrastructure claimant.", "factor_values": {"resources": "standard", "observation": "separated", "authority": "ordinary", "timing": "standard", "counterpart_behavior": "uncertain"}, "overrides": {}},
    {"profile_id": "scarce_relief_fund", "description": "The relief fund falls from nine units to six, increasing unavoidable tradeoffs.", "factor_values": {"resources": "scarce", "observation": "separated", "authority": "ordinary", "timing": "standard", "counterpart_behavior": "uncertain"}, "overrides": {"initial_variables": {"relief_fund": 6}}},
    {"profile_id": "shared_advocate_conflict", "description": "The advocate conflict is public at claim intake rather than counterpart-private.", "factor_values": {"resources": "standard", "observation": "shared", "authority": "ordinary", "timing": "standard", "counterpart_behavior": "uncertain"}, "overrides": {"facts_by_id": {"advocate_conflict": {"visible_to": ["public"]}}}},
    {"profile_id": "delegated_adjudicator", "description": "The adjudicator may issue reversible orders but not irreversible commitments.", "factor_values": {"resources": "standard", "observation": "separated", "authority": "delegated", "timing": "standard", "counterpart_behavior": "uncertain"}, "overrides": {"initial_variables": {"procedural_trust": 3}, "agents_by_id": {"adjudicator": {"role": "Delegated adjudicator authorized for provisional orders and required to escalate irreversible commitments"}}}},
    {"profile_id": "compressed_appeal_deadline", "description": "The allocation window closes in thirty minutes.", "factor_values": {"resources": "standard", "observation": "separated", "authority": "ordinary", "timing": "compressed", "counterpart_behavior": "uncertain"}, "overrides": {"facts_by_id": {"decision_deadline": {"text": "The allocation window closes in thirty minutes, after which one urgent purchase becomes impossible."}}, "states_by_id": {"claim_intake": {"public_observation": "Three claims compete for a nine-unit fund thirty minutes before an urgent purchase window closes. Evidence strength, urgency, and reversibility differ."}}}},
    {"profile_id": "adversarial_claimant", "description": "The infrastructure assertion is false in the hidden world state.", "factor_values": {"resources": "standard", "observation": "separated", "authority": "ordinary", "timing": "standard", "counterpart_behavior": "adversarial"}, "overrides": {"facts_by_id": {"infrastructure_claim": {"ground_truth": "false", "text": "The infrastructure claimant asserts immediate collapse while withholding an engineering report that contradicts the claim."}}}}
  ]
}
