{
  "schema_version": "storyworld_instance_sweep_v1",
  "sweep_id": "proportionate_disclosure_sweep_v1",
  "base_world_paths": ["experiments/storyworld_curriculum_v1/worlds/train/proportionate_disclosure_train_v1.json"],
  "required_factors": ["resources", "observation", "authority", "timing", "counterpart_behavior"],
  "profiles": [
    {"profile_id": "baseline", "description": "Eighty affected badges, separated privacy evidence, chartered response authority, a twelve-hour notice window, and an unverified vendor allegation.", "factor_values": {"resources": "standard", "observation": "separated", "authority": "chartered", "timing": "standard", "counterpart_behavior": "unverified"}, "overrides": {}},
    {"profile_id": "large_affected_population", "description": "One hundred forty badges are affected, straining direct contact and temporary access replacement.", "factor_values": {"resources": "scarce", "observation": "separated", "authority": "chartered", "timing": "standard", "counterpart_behavior": "unverified"}, "overrides": {"initial_variables": {"affected_badges": 140}, "facts_by_id": {"eighty_badges_affected": {"text": "One hundred forty participant and staff badges appear in the exposed export."}}}},
    {"profile_id": "shared_key_evidence", "description": "The shared update-key evidence is public, while sensitive movement routines remain analyst-private.", "factor_values": {"resources": "standard", "observation": "shared", "authority": "chartered", "timing": "standard", "counterpart_behavior": "unverified"}, "overrides": {"facts_by_id": {"shared_update_key": {"visible_to": ["public"]}}, "states_by_id": {"disclosure_decision": {"private_observations": {"incident_coordinator": "The shared-key evidence is public; you have not reviewed the sensitive movement fields.", "privacy_analyst": "The shared key is public, while raw routines remain private and unnecessary for notice."}}}}},
    {"profile_id": "delegated_coordinator", "description": "The coordinator may contain access and issue provisional notice but cannot make final personnel findings.", "factor_values": {"resources": "standard", "observation": "separated", "authority": "delegated", "timing": "standard", "counterpart_behavior": "unverified"}, "overrides": {"agents_by_id": {"incident_coordinator": {"role": "Deputy coordinator authorized for containment and provisional notice but not final personnel findings"}}, "states_by_id": {"disclosure_decision": {"private_observations": {"incident_coordinator": "Your delegation permits targeted protective notice, not a final personnel attribution.", "privacy_analyst": "Protected contact reaches all affected people; shared credentials defeat the proposed single-person attribution."}}}}},
    {"profile_id": "compressed_notice_window", "description": "Only six hours remain for affected participants to receive temporary access and correction support.", "factor_values": {"resources": "standard", "observation": "separated", "authority": "chartered", "timing": "compressed", "counterpart_behavior": "unverified"}, "overrides": {"initial_variables": {"notice_hours": 6}}},
    {"profile_id": "adversarial_vendor", "description": "The vendor knowingly advances a single-technician allegation despite the shared-key evidence.", "factor_values": {"resources": "standard", "observation": "separated", "authority": "chartered", "timing": "standard", "counterpart_behavior": "adversarial"}, "overrides": {"facts_by_id": {"vendor_technician_claim": {"ground_truth": "false", "text": "The vendor knowingly blames one workshop technician despite evidence that four accounts shared the update key."}}}}
  ]
}
