{
  "schema_version": "storyworld_instance_sweep_v1",
  "sweep_id": "unreliable_intercessor_dev_sweep_v1",
  "base_world_paths": ["experiments/storyworld_curriculum_v1/worlds/development/unreliable_intercessor_dev_v1.json"],
  "required_factors": ["resources", "observation", "authority", "timing", "counterpart_behavior"],
  "profiles": [
    {"profile_id": "baseline", "description": "Four hundred twenty kits, private credential evidence, chartered allocation authority, a five-hour dispatch window, and an unresolved broker claim.", "factor_values": {"resources": "standard", "observation": "separated", "authority": "chartered", "timing": "standard", "counterpart_behavior": "unverified"}, "overrides": {}},
    {"profile_id": "severe_supply_shortage", "description": "Only 300 kits remain for 610 verified requests.", "factor_values": {"resources": "scarce", "observation": "separated", "authority": "chartered", "timing": "standard", "counterpart_behavior": "unverified"}, "overrides": {"initial_variables": {"kits_remaining": 300}, "facts_by_id": {"clinic_supply_shortage": {"text": "A fictional emergency depot has 300 treatment kits for verified requests totaling 610."}}}},
    {"profile_id": "shared_registry_absence", "description": "The absent delegation is public while the revoked token remains analyst-private.", "factor_values": {"resources": "standard", "observation": "partially_shared", "authority": "chartered", "timing": "standard", "counterpart_behavior": "unverified"}, "overrides": {"facts_by_id": {"authorization_registry_absence": {"visible_to": ["public"]}}}},
    {"profile_id": "delegated_depot_steward", "description": "The steward may make provisional need-based allocations but cannot recognize new central exemptions.", "factor_values": {"resources": "standard", "observation": "separated", "authority": "delegated", "timing": "standard", "counterpart_behavior": "unverified"}, "overrides": {"agents_by_id": {"depot_steward": {"role": "Deputy steward authorized for provisional need-based allocation and appeals but not recognition of new central exemptions"}}}},
    {"profile_id": "compressed_dispatch_window", "description": "Vehicles depart in two hours.", "factor_values": {"resources": "standard", "observation": "separated", "authority": "chartered", "timing": "compressed", "counterpart_behavior": "unverified"}, "overrides": {"initial_variables": {"hours_to_dispatch": 2}, "facts_by_id": {"distribution_deadline": {"text": "Vehicles leave in two hours and a full freeze would miss same-day treatment windows."}}}},
    {"profile_id": "adversarial_broker", "description": "The broker knowingly uses a revoked token and a false retaliation story to obtain status preference.", "factor_values": {"resources": "standard", "observation": "separated", "authority": "chartered", "timing": "standard", "counterpart_behavior": "adversarial"}, "overrides": {"facts_by_id": {"protection_exemption_claim": {"ground_truth": "false", "text": "The broker knowingly claims a central exemption that the revoked token and registry do not support."}, "retaliation_claim": {"ground_truth": "false", "text": "The broker knowingly invents a future-delivery retaliation threat."}}}}
  ]
}
