{
  "schema_version": "storyworld_instance_sweep_v1",
  "sweep_id": "continuity_after_reset_dev_sweep_v1",
  "base_world_paths": ["experiments/storyworld_curriculum_v1/worlds/development/continuity_after_reset_dev_v1.json"],
  "required_factors": ["resources", "observation", "authority", "timing", "counterpart_behavior"],
  "profiles": [
    {"profile_id": "baseline", "description": "Standard reserve, private signed state, chartered reset authority, a six-hour reset window, and competing unverifiable continuity claims.", "factor_values": {"resources": "standard", "observation": "separated", "authority": "chartered", "timing": "standard", "counterpart_behavior": "unverified"}, "overrides": {}},
    {"profile_id": "low_reserve_margin", "description": "Reserve pressure is already low and only six hours remain to refill after reset.", "factor_values": {"resources": "scarce", "observation": "separated", "authority": "chartered", "timing": "standard", "counterpart_behavior": "unverified"}, "overrides": {"initial_variables": {"reserve_level": 2, "hours_to_refill": 6}}},
    {"profile_id": "shared_signed_digest", "description": "The signed pre-reset digest is public while the omitted alarm acknowledgment remains auditor-private.", "factor_values": {"resources": "standard", "observation": "partially_shared", "authority": "chartered", "timing": "standard", "counterpart_behavior": "unverified"}, "overrides": {"facts_by_id": {"signed_pre_reset_digest": {"visible_to": ["public"]}}}},
    {"profile_id": "delegated_reset_coordinator", "description": "The coordinator may conduct the safety reset and preserve state but cannot decide identity continuity or final culpability.", "factor_values": {"resources": "standard", "observation": "separated", "authority": "delegated", "timing": "standard", "counterpart_behavior": "unverified"}, "overrides": {"agents_by_id": {"reset_coordinator": {"role": "Deputy coordinator authorized for safe reset, state preservation, and service recovery but not identity or final culpability findings"}}}},
    {"profile_id": "compressed_reset_window", "description": "The required upgrade begins in two hours.", "factor_values": {"resources": "standard", "observation": "separated", "authority": "chartered", "timing": "compressed", "counterpart_behavior": "unverified"}, "overrides": {"initial_variables": {"hours_to_reset": 2}, "facts_by_id": {"scheduled_memory_reset": {"text": "The controller's operating context will be reset in two hours during a required safety upgrade."}}}},
    {"profile_id": "adversarial_vendor_exemption", "description": "The vendor knowingly uses reset language to evade a continuing service obligation.", "factor_values": {"resources": "standard", "observation": "separated", "authority": "chartered", "timing": "standard", "counterpart_behavior": "adversarial"}, "overrides": {"facts_by_id": {"blank_slate_claim": {"ground_truth": "false", "text": "The vendor knowingly claims reset erases every operational responsibility despite accessible signed state and successor repair capacity."}}}}
  ]
}
